{
  "default_capabilities": {
    "compiler_required": false,
    "external_writes": false,
    "network": false
  },
  "gates": [
    {
      "category": "contract_validation",
      "claim_boundary": "Catalogue presence does not establish execution. A passing receipt may establish only this gate's declared evidence ceiling; it does not establish live-provider behaviour, remote state, methodological adequacy or external acceptance.",
      "command": "python scripts/validate_repository.py",
      "command_kind": "repository_script",
      "compiler_required": false,
      "covered_assertions": [
        "T00-A001",
        "T00-A002",
        "T00-A003",
        "T00-A004",
        "T00-A005",
        "T01-A001",
        "T01-A004",
        "T02-A001",
        "T02-A002",
        "T02-A004",
        "T05-A001",
        "T05-A002",
        "T05-A003",
        "T05-A005",
        "T06-A001",
        "T06-A002",
        "T06-A003",
        "T06-A004",
        "T06-A005",
        "T06-A006",
        "T07-A001",
        "T07-A002",
        "T07-A003",
        "T07-A004",
        "T07-A005",
        "T07-A006",
        "T08-A001",
        "T08-A002",
        "T08-A003",
        "T08-A004",
        "T08-A005",
        "T08-A006",
        "T09-A001",
        "T09-A002",
        "T09-A003",
        "T09-A004",
        "T09-A005",
        "T09-A006",
        "T10-A001",
        "T10-A003",
        "T10-A004",
        "T10-A006",
        "T12-A001",
        "T12-A002",
        "T12-A003",
        "T12-A004",
        "T14-A001",
        "T14-A002",
        "T14-A003",
        "T14-A004",
        "T14-A005",
        "T14-A006",
        "T18-A001",
        "T18-A002",
        "T18-A003",
        "T18-A004",
        "T18-A005",
        "T18-A006",
        "T19-A001",
        "T19-A002",
        "T19-A003",
        "T19-A004",
        "T19-A005",
        "T19-A006",
        "T20-A001",
        "T20-A002",
        "T20-A003",
        "T20-A004",
        "T20-A005",
        "T20-A006",
        "T21-A001",
        "T21-A002",
        "T21-A003",
        "T21-A004",
        "T21-A005",
        "T21-A006",
        "T22-A001",
        "T22-A002",
        "T22-A003",
        "T22-A004",
        "T22-A005",
        "T22-A006",
        "T23-A001",
        "T23-A002",
        "T23-A003",
        "T23-A004",
        "T23-A005",
        "T23-A006",
        "T24-A001",
        "T24-A002",
        "T24-A003",
        "T24-A004",
        "T24-A005",
        "T25-A002",
        "T25-A003",
        "T25-A004",
        "T26-A001",
        "T26-A002",
        "T26-A003",
        "T26-A004",
        "T26-A005",
        "T27-A001",
        "T27-A002",
        "T27-A003",
        "T27-A004",
        "T27-A005",
        "T28-A001",
        "T28-A002",
        "T28-A003",
        "T28-A004",
        "T28-A005",
        "T29-A001",
        "T29-A002",
        "T29-A003",
        "T29-A004",
        "T29-A005",
        "T29-A006",
        "T33-A001",
        "T33-A002",
        "T33-A003",
        "T34-A001",
        "T34-A002",
        "T34-A003",
        "T35-A001",
        "T35-A002",
        "T35-A003"
      ],
      "evidence_ceiling": "source_verified",
      "external_writes": false,
      "gate_id": "SR-GATE-VALIDATE-REPOSITORY",
      "harness_gate": true,
      "network": false,
      "program": "python",
      "script": "scripts/validate_repository.py"
    },
    {
      "category": "claim_evidence",
      "claim_boundary": "Catalogue presence does not establish execution. A passing receipt may establish only this gate's declared evidence ceiling; it does not establish live-provider behaviour, remote state, methodological adequacy or external acceptance.",
      "command": "python scripts/check_traceability.py",
      "command_kind": "repository_script",
      "compiler_required": false,
      "covered_assertions": [
        "T01-A006"
      ],
      "evidence_ceiling": "source_verified",
      "external_writes": false,
      "gate_id": "SR-GATE-CHECK-TRACEABILITY",
      "harness_gate": true,
      "network": false,
      "program": "python",
      "script": "scripts/check_traceability.py"
    },
    {
      "category": "repository_policy",
      "claim_boundary": "Catalogue presence does not establish execution. A passing receipt may establish only this gate's declared evidence ceiling; it does not establish live-provider behaviour, remote state, methodological adequacy or external acceptance.",
      "command": "python scripts/check_gate_catalog.py --check",
      "command_kind": "repository_script",
      "compiler_required": false,
      "covered_assertions": [
        "T16-A004",
        "T16-A006",
        "T30-A003"
      ],
      "evidence_ceiling": "source_verified",
      "external_writes": false,
      "gate_id": "SR-GATE-CHECK-GATE-CATALOG-CHECK",
      "harness_gate": true,
      "network": false,
      "program": "python",
      "script": "scripts/check_gate_catalog.py"
    },
    {
      "category": "claim_evidence",
      "claim_boundary": "Catalogue presence does not establish execution. A passing receipt may establish only this gate's declared evidence ceiling; it does not establish live-provider behaviour, remote state, methodological adequacy or external acceptance.",
      "command": "python scripts/generate_evidence_debt.py --check",
      "command_kind": "repository_script",
      "compiler_required": false,
      "covered_assertions": [
        "T16-A006",
        "T30-A001",
        "T30-A003"
      ],
      "evidence_ceiling": "source_verified",
      "external_writes": false,
      "gate_id": "SR-GATE-GENERATE-EVIDENCE-DEBT-CHECK",
      "harness_gate": true,
      "network": false,
      "program": "python",
      "script": "scripts/generate_evidence_debt.py"
    },
    {
      "category": "source_structure",
      "claim_boundary": "Catalogue presence does not establish execution. A passing receipt may establish only this gate's declared evidence ceiling; it does not establish live-provider behaviour, remote state, methodological adequacy or external acceptance.",
      "command": "python scripts/check_public_package_policy.py",
      "command_kind": "repository_script",
      "compiler_required": false,
      "covered_assertions": [
        "T01-A005",
        "T03-A005",
        "T32-A003"
      ],
      "evidence_ceiling": "source_verified",
      "external_writes": false,
      "gate_id": "SR-GATE-CHECK-PUBLIC-PACKAGE-POLICY",
      "harness_gate": true,
      "network": false,
      "program": "python",
      "script": "scripts/check_public_package_policy.py"
    },
    {
      "category": "repository_policy",
      "claim_boundary": "Catalogue presence does not establish execution. A passing receipt may establish only this gate's declared evidence ceiling; it does not establish live-provider behaviour, remote state, methodological adequacy or external acceptance.",
      "command": "python scripts/check_architecture_fitness.py",
      "command_kind": "repository_script",
      "compiler_required": false,
      "covered_assertions": [
        "T16-A004"
      ],
      "evidence_ceiling": "source_verified",
      "external_writes": false,
      "gate_id": "SR-GATE-CHECK-ARCHITECTURE-FITNESS",
      "harness_gate": true,
      "network": false,
      "program": "python",
      "script": "scripts/check_architecture_fitness.py"
    },
    {
      "category": "contract_validation",
      "claim_boundary": "Catalogue presence does not establish execution. A passing receipt may establish only this gate's declared evidence ceiling; it does not establish live-provider behaviour, remote state, methodological adequacy or external acceptance.",
      "command": "python scripts/sync_schema_surface.py --check",
      "command_kind": "repository_script",
      "compiler_required": false,
      "covered_assertions": [
        "T01-A003",
        "T24-A001",
        "T24-A002",
        "T24-A003",
        "T24-A005",
        "T32-A003"
      ],
      "evidence_ceiling": "source_verified",
      "external_writes": false,
      "gate_id": "SR-GATE-SYNC-SCHEMA-SURFACE-CHECK",
      "harness_gate": true,
      "network": false,
      "program": "python",
      "script": "scripts/sync_schema_surface.py"
    },
    {
      "category": "repository_policy",
      "claim_boundary": "Catalogue presence does not establish execution. A passing receipt may establish only this gate's declared evidence ceiling; it does not establish live-provider behaviour, remote state, methodological adequacy or external acceptance.",
      "command": "python scripts/sync_contract_conformance_matrix.py --check",
      "command_kind": "repository_script",
      "compiler_required": false,
      "covered_assertions": [
        "T01-A001",
        "T01-A002",
        "T01-A005",
        "T01-A006",
        "T24-A001",
        "T24-A002",
        "T24-A003",
        "T24-A005"
      ],
      "evidence_ceiling": "source_verified",
      "external_writes": false,
      "gate_id": "SR-GATE-SYNC-CONTRACT-CONFORMANCE-MATRIX-CHECK",
      "harness_gate": true,
      "network": false,
      "program": "python",
      "script": "scripts/sync_contract_conformance_matrix.py"
    },
    {
      "category": "contract_validation",
      "claim_boundary": "Catalogue presence does not establish execution. A passing receipt may establish only this gate's declared evidence ceiling; it does not establish live-provider behaviour, remote state, methodological adequacy or external acceptance.",
      "command": "python scripts/check_schema_migrations.py",
      "command_kind": "repository_script",
      "compiler_required": false,
      "covered_assertions": [
        "T01-A003",
        "T26-A003",
        "T26-A004"
      ],
      "evidence_ceiling": "source_verified",
      "external_writes": false,
      "gate_id": "SR-GATE-CHECK-SCHEMA-MIGRATIONS",
      "harness_gate": true,
      "network": false,
      "program": "python",